artist,song,lyrics,bert_nega,bert_posi,bert_score,nltk_neg,nltk_neu,nltk_pos,nltk_score
Miley Cyrus,Flowers,"We were good, we were gold Kind of dream that can't be sold We were right 'til we weren't Built a home and watched it burn  Mm, I didn't wanna leave you, I didn't wanna lie Started to cry, but then remembered I  I can buy myself flowers Write my name in the sand Talk to myself for hours Say things you don't understand I can take myself dancing And I can hold my own hand Yeah, I can love me better than you can  Can love me better, I can love me better, baby Can love me better, I can love me better, baby  ",13,9,-0.14474039457061075,0,15,7,0.23812727272727277
SZA,Kill Bill,"I'm still a fan even though I was salty Hate to see you with some other broad, know you happy Hate to see you happy if I'm not the one driving  I'm so mature, I'm so mature I'm so mature, I got me a therapist to tell me there's other men I don't want none, I just want you If I can't have you, no one should I might  I might kill my ex, not the best idea His new girlfriend's next, how'd I get here? I might kill my ex, I still love him though Rather be in jail than alone  I get the sense that it's a lost cause I get the sense that you might really love her ",15,7,-0.20704774964939465,2,16,4,0.0542090909090909
"Metro Boomin, The Weeknd, 21 Savage",Creepin' (with The Weeknd & 21 Savage),"Oooh Just can't believe this man (Metro Boomin want some more nigga)  Somebody said they saw you The person you were kissing wasn't me And I would never ask you, I just kept it to myself  I don't wanna know, if you're playing me Keep it on the low Cause my heart can't take it anymore And if you creeping, please don't let it show Oh baby, I don't wanna know  I think about it when I hold you When looking in your eyes, I can't believe And I don't need to know the truth But baby keep it to yourself  I don't wanna know, if you're playing me Keep it on the low ",17,7,-0.23923915872971216,0,24,0,0.047654166666666664
"Metro Boomin, Future, Chris Brown",Superhero (Heroes & Villains) [with Future & Chris Brown],"(Metro, metro, metro, metro) Drankin' dope turned me to a superhero, yeah, yeah Hit that pill, turned me to a superhero, yeah, yeah Boominati turned me to a superhero, yeah, yeah (Metro) (If Young Metro don't trust you, I'm gon' shoot you)  I'm on that dope again, I'm in that flow again Switch up the flow again, yeah, yeah Flyer than a parachute, gripping that pole again I'm on that oil again, yeah, yeah  Candy in the cup, gotta get paid King in the streets, young nigga made Sprayin' up the crowd, take it to the grave Ain't havin' problems, I'm sippin' the bar Shoutout to Dallas, my bitch is a star Nigga get rich, ready take you to war Piss on your casket, shoot at your broad  Do you something nasty, roll you in a 'gar Bitch get graphic, fuck me in a car I get you a brand new Rollie tomorrow I put that brand new Rollie on your arm Ain't movin' slow but I'm still on oil Tennis bracelets and they came with the frost Cuban links all the way up to your jaw ",28,5,-0.42736546017906885,1,30,2,-0.013978787878787887
"Drake, 21 Savage",Rich Flex,"Go buy a zip of weed, hit the club Pay for 'bout ten nigga to get in, we crunk, lit in this bitch, yeah  (Body up, yuh, yuh) Know we walk around the world (Body up, yuh, yuh) Steppin' not givin' a damn 'bout where our feet land at  Yeah, get your ass mushed, smooshed (6ix) Yeah, 21, the biggest  Put a nigga in the chicken wing, pussy  21, can you do some' for me? (21) Can you hit a lil' rich flex for me? (21) And 21, can you do sum' for me? (21, 21) Drop some bars to my pussy ex to me And 21 (21), can you do some' for me? (Yeah) Can you talk to the opps necks for me? (Okay) 21, do your thing, 21, do your thing (21) Do your thing, 21, do your thing  Yellow diamonds in the watch, this shit cost a lot Never send a bitch your dot, that's how you get shot I DM in Vanish Mode, I do that shit a lot Took her panties off and this bitch thicker than a plot  All my exes ain't nothin', them hoes busted If my opps ain't rappin', they ass duckin' ",18,10,-0.19059301912784576,1,25,2,-0.03460714285714285
Lil Uzi Vert,Just Wanna Rock,"Ah, ah, ah, ah I just wanna rock Body-ody, yeah (shake it down)  Damn Damn  (MC, make another hit) whoa! This ain't what you want (Project, Project X) This ain't what you want This ain't what you want  Ha! 1600 block, I just wanna rock (shake it down) I just wanna, ah, ah, ah, ah, ah, ah, ah I just wanna rock, body-ody, yeah (shake it down) Shawty got that body-ody, ah, ah, ah (shake it down) ",16,2,-0.4385040005048116,3,14,1,-0.032427777777777785
"Bizarrap, Shakira","Shakira: Bzrp Music Sessions, Vol. 53","Pa tipos como tú-ú-ú-ú-ú Oh-oh (oh-oh) Pa tipos como tú-ú-ú-ú-ú  Perdón, ya cogí otro avión Aquí no vuelvo, no quiero otra decepción Tanto que te la' das de campeón Y, cuando te necesitaba, diste tu peor versión  Sorry, baby, hace rato Que yo debí botar ese gato Una loba como yo no está pa novatos Una loba como yo no está  Pa tipos como tú-ú-ú-ú-ú Pa tipos como tú-ú-ú-ú-ú A ti te quedé grande, por eso estás Con una igualita que tú-ú-ú-ú-ú Oh-oh, oh-oh  Esto es pa que te mortifique', mastique', trague', trague', mastique' Yo contigo ya no regreso, ni que me llore', ni me supliques Entendí que no es culpa mía que te critiquen Yo solo hago música, perdón que te sal-pique  Me dejaste de vecina a la suegra ",15,6,-0.30185074181783766,0,21,0,-0.07104285714285714
The Weeknd,Die For You,"I'm findin' ways to articulate the feeling I'm goin' through I just can't say I don't love you 'Cause I love you, yeah It's hard for me to communicate the thoughts that I hold But tonight, I'm gon' let you know Let me tell the truth Baby, let me tell the truth, yeah  You know what I'm thinkin', see it in your eyes You hate that you want me, hate it when you cry You're scared to be lonely, especially in the night I'm scared that I'll miss you, happens every time I don't want this feelin', I can't afford love I try to find a reason to pull us apart It ain't workin' 'cause you're perfect And I know that you're worth it I can't walk away, (oh)  Even though we're going through it And it makes you feel alone Just know that I would die for you Baby, I would die for you, yeah ",23,8,-0.28541103870637957,6,24,1,-0.06616129032258064
Taylor Swift,Anti-Hero,"I have this thing where I get older, but just never wiser Midnights become my afternoons When my depression works the graveyard shift All of the people I've ghosted stand there in the room  I should not be left to my own devices They come with prices and vices I end up in crises Tale as old as time I wake up screaming from dreaming One day I'll watch as you're leaving 'Cause you got tired of my scheming For the last time  It's me Hi! I'm the problem, it's me At teatime Everybody agrees I'll stare directly at the sun, but never in the mirror It must be exhausting always rooting for the anti-hero  Sometimes I feel like everybody is a sexy baby ",14,10,-0.0999224583307902,1,21,2,-0.07117499999999999
Miguel,Sure Thing,"Love you like a brother Treat you like a friend Respect you like a lover Oh-woah, oh-woah, oh-woah  You could bet that, never gotta sweat that You could bet that, never gotta sweat that You could bet that, never gotta sweat that You could bet that, never gotta sweat that  If you be the cash, I'll be the rubber band You be the match, I will be a fuse, boom Painter, baby, you could be the muse I'm the reporter, baby, you could be the news 'Cause you're the cigarette and I'm the smoker We raise the bet 'cause you're a joker Checked off, you are the chalk And I could be the blackboard You can be the talk and I can be the walk  Even when the sky comes falling Even when the sun don't shine I got faith in you and I So put your pretty little hand in mine Even when we're down to the wire, babe Even when it's do or die ",17,12,-0.09991305860979803,0,24,5,0.10293793103448276
JVKE,golden hour,"It was just two lovers, sittin' in the car, listening to Blonde Fallin' for each other, pink and orange skies, feelin' super childish No Donald Glover, missed call from my mother Like, ""Where you at tonight?"" Got no alibi  I was all alone with the love of my life She's got glitter for skin, my radiant beam in the night I don't need no light to see you  Shine ",9,4,-0.22935931499187762,2,10,1,0.12276153846153845
Steve Lacy,Bad Habit,"(I wish I knew you) wanted me I wish I knew, I wish I knew you wanted me I wish I knew, I wish I knew you wanted me  What you, ooh, uh, what you do? Made a move, coulda made a move If I knew I'd be with you Is it too late to pursue?  I bite my tongue, it's a bad habit Kinda mad that I didn't take a stab at it Thought you were too good for me, my dear Never gave me time of day, my dear It's okay, things happen for Reasons that I think are sure, yeah  I wish I knew, I wish I knew you wanted me I wish I knew (oh), I wish I knew you wanted me ",15,17,-0.001964358612895012,1,21,10,0.15392812500000003
The Kid LAROI,Love Again,"Can we go back to how it was Before my pride got in-between us Go ahead and hit me where it hurts Because at least then I'll feel something  Screamin' in my face Kicked me out your place I got nowhere to go  Can we find love again? Is this time the end? Tell me, how many more tears will drop? 'Til you hit me with, can we talk? And try love again ",8,5,-0.15096068382263184,0,11,2,0.045092307692307695
d4vd,Romantic Homicide,"I'm scared  It feels like you don't care  Enlighten me, my dear  Why am I still here?  I don't mean to be complacent with the decisions you made ",4,2,-0.22960278391838074,1,4,1,0.026499999999999996
"Sam Smith, Kim Petras",Unholy (feat. Kim Petras),"Mummy don't know daddy's getting hot At the body shop, doing something unholy  He lucky, lucky, yeah (ooh) He lucky, lucky, yeah (ye-yeah) He lucky, lucky, yeah He lucky, lucky, yeah  A lucky, lucky girl She got married to a boy like you She'd kick you out if she ever, ever knew 'Bout all the - you tell me that you do  Dirty, dirty boy You know everyone is talking on the scene ",6,6,-0.033634896079699196,1,6,5,0.2879083333333333
Zach Bryan,Something in the Orange,"It'll be fine by dusk that I'm telling you, baby These things eat at your bones and drive your young mind crazy But when you place your head between my collar and jaw I don't know much, but there's no weight at all  And I'm damned if I do, and I'm damned if I don't 'Cause if I say I miss you, I know that you won't But I miss you in the mornings when I see the sun Something in the orange tells me we're not done  To you, I'm just a man To me, you're all I am Where the hell am I supposed to go? ",16,8,-0.20070302983125052,4,20,0,-0.09624166666666667
"Zach Bryan, Maggie Rogers",Dawns (feat. Maggie Rogers),"Wake me up when the season's gone 'Cause I've wasted all my dawns on you So what do I do? Oh, what I do?  I get fucked up just 'cause I'm scared Love's just another drug I have grown a victim to So what do I do? Oh, what do I do?  All is fair in love and war So what the hell are we even fightin' for? I'm on your front porch beggin' for my dawns back Give my goddamn records and my clothes back 'Cause I'm through Oh, how I'm through  And by the time she wakes, I'll be halfway to my mama's home It just dawned on me, life is as fleeting as the passin' dawn And it was my mistake 'cause she never said a thing about Jesus ",20,8,-0.2624862108911787,2,25,1,-0.10744285714285715
Harry Styles,As It Was,"Come on, Harry, we wanna say ""good night"" to you!  Holding me back Gravity's holding me back I want you to hold out the palm of your hand Why don't we leave it at that?  Nothing to say When everything gets in the way Seems you cannot be replaced And I'm the one who will stay Oh-oh-oh  In this world It's just us You know it's not the same as it was  In this world It's just us You know it's not the same as it was ",16,2,-0.4347105291154649,0,18,0,0.059616666666666665
SZA,Low,"Tell 'em to shoot I'm out the loop, I'm outta range Oh-yeah, I stay out the way-ay-ay!  Got another side of me, I like to get it poppin' But these bitches in my business got me outchea choosin' violence If you see me out in public, you don't know me, keep it silent In the bedroom, I be screamin', but outside, I keep it quiet  Keep it on the lowski, I'm the lowest of the lowest Wanna see if you can keep it like nobody knows shit  I need you to get the fuck out of my space (yeah) Replacement's on the way, please don't play That pussy's feelin' like a great escape (oh, oh) Don't need no trick, old dogs don't change  I'm fuckin', I ain't makin' love no more (pussy) You got a new bitch, what the fuck you cryin' for? I'm movin' selfish, callin' all my favorite hoes  ",18,5,-0.3522779915643775,2,20,1,-0.10461739130434783
d4vd,Here With Me,"Watch the sunrise along the coast As we're both getting old I can't describe what I'm feeling And all I know is we're going home So please don't let me go, oh Don't let me go, oh-oh-oh  And if it's right I don't care how long it takes As long as I'm with you ",8,4,-0.21753031512101492,0,11,1,0.010074999999999995
SZA,Snooze,"I'll touch that fire for you I do that three-four times again, I testify for you I told that lie, I'd kill that bitch I do what all of them around you scared to do, I'm not Long as you juggin' out here for me, I got it Mobbing, scheming, looting, hide your bodies Long as you dreaming 'bout me, ain't no problem I don't got nobody, just with you right now Tell the truth, I look better under you  I can't lose when I'm with you How can I snooze and miss the moment? You just too important Nobody do body like you do  I can't lose when I'm with you I can't just snooze and miss the moment You just too important Nobody do body like you do, you do  In the droptop ride with you, I feel like Scarface (Scarface) Like the white bitch with the bob, I'll be your main one (main one) ",21,10,-0.21029848437155446,1,26,4,0.029274193548387097
J. Cole,No Role Modelz,"First things first: Rest In Peace Uncle Phil, for real You the only father that I ever knew I get my bitch pregnant, I'mma be a better you Prophecies that I made way back in the Ville, fulfilled Listen even back when we was broke my team ill Martin Luther King would have been on Dreamville Talk to a nigga",12,7,-0.1758147540845369,1,16,2,0.007236842105263161
Morgan Wallen,Last Night,"Last night we let the liquor talk I can't remember everything we said but we said it all You told me that you wish I was somebody you never met But baby, baby somethings tellin' me this ain't over yet No way it was our last night  I kiss your lips Make you grip the sheets with your fingertips Last bottle of Jack we split a fifth Just talk about life goin' sip for sip You, you know you love to fight And I say shit I don't mean But I'm still gon' wake up wantin' you and me  I know that last night we let the liquor talk ",6,12,0.17499417066574097,1,16,1,0.019544444444444444
"RAYE, 070 Shake",Escapism.,"Sleazin' and teasin', I'm sittin' on him All of my diamonds are drippin' on him I met him at the bar, it was 12 or somethin' I ordered two more wines, 'cause tonight, I want him  A little context if you care to listen I find myself in a shit position The man that I love sat me down last night And he told me that it's over, dumb decision And I don't wanna feel how my heart is rippin' In fact, I don't wanna feel, so I stick to sippin' And I'm out on the town with a simple mission In my little black dress, and this shit is sittin'  Just a heart broke bitch, high heels, six inch In the back of the nightclub, sippin' champagne I don't trust any of these bitches I'm with In the back of the taxi, sniffin' cocaine Drunk calls, drunk texts, drunk tears, drunk sex I was lookin' for a man who was on the same page Now it's back to the intro, back to the bar To the Bentley, to the hotel, to my old ways  'Cause I don't wanna feel how I did last night I don't wanna feel how I did last night Doctor, doctor, anything, please Doctor, doctor, have mercy on me, take this pain away You're asking me my symptoms, doctor, I don't wanna feel  ",24,14,-0.16308334626649557,3,34,1,-0.06874736842105263
"Fuerza Regida, Grupo Frontera",Bebe Dame,"Fierro, ánimo De las cumbias originales Con mis compas, Grupo Frontera Y Fuerza Regida, compadre ¡Fierro, pues, márquele' compa Carlos! ¡Dice! (ánimo, ánimo)  Tengo tiempo pensando en los dos Si podemos arreglar la situación  Lo nuestro es una guerra en el amor Defiendo lo que me pide el corazón  Quiero comerte yo todos los días Me enamorabas con lo que decías Tenerte de nuevo es mi fantasía  Bebé, lo que te pido, ven, dame Lo que te exijo, no quisiera que Pase otro día y no te vea al amanecer  Bebé, lo que te pido, ven, dame ",15,7,-0.2465772032737732,0,21,1,0.0009272727272727311
Tory Lanez,The Color Violet,"I took my drugs and took my lovin' when I left out the spot I left the party with a barbie marking X on the dot (uh) She calls my phone up, but I told her, ""I'm a loner"" (uh) But she likes my watch and my droptop and my persona (uh)  We hit the highway, 1-5-5, with my whole foot on the dash She's in my ear, she's got no fear, she could care less if we crash But on my radar, I've got some nerve to play hard I've waited for my chance, but playboys we don't dance, dance, dance  I gave my heart Speedin' car goin' 90 in the rain She took my heart, filled it with nothin' but pain This beat in my dance is not for romance ",12,5,-0.23704070904675653,1,16,0,-0.0376
Taylor Swift,Lavender Haze,"Meet me at midnight  Staring at the ceiling with you Oh, you don't ever say too much And you don't really read into My melancholia  I've been under scrutiny (yeah, oh, yeah) You handle it beautifully (yeah, oh, yeah) All this shit is new to me (yeah, oh, yeah)  I feel the lavender haze creeping up on me Surreal, I'm damned if I do give a damn what people say No deal, the 1950s shit they want from me I just wanna stay in that lavender haze  All they keep asking me (all they keep asking me) ",8,7,-0.07631391684214274,2,13,0,-0.10451333333333332
"David Guetta, Bebe Rexha",I'm Good (Blue),"I'm good, yeah, I'm feelin' alright Baby, I'ma have the best fuckin' night of my life And wherever it takes me, I'm down for the ride Baby, don't you know I'm good? Yeah, I'm feelin' alright  'Cause I'm good, yeah, I'm feelin' alright Baby, I'ma have the best fuckin' night of my life And wherever it takes me, I'm down for the ride Baby, don't you know I'm good? Yeah, I'm feelin' alright  Don't you know I'm good? Yeah, I'm feelin' alright  You know I'm down for whatever tonight ",25,2,-0.5057220083695871,0,14,13,0.22158518518518522
SZA,Nobody Gets Me,"Took a long vacation, no makeup, just Jay-Z You were balls deep, now we beefin', had me butt-naked at the MGM So wasted screamin', ""Fuck that,"" love me now, but I'm anythin' Hurry now, baby, stick it in 'fore the memories get to kickin' in  It's too late, I don't wanna lose what's left of you  How am I supposed to tell ya? I don't wanna see you with anyone but me Nobody gets me like you How am I supposed to let you go? Only like myself when I'm with you Nobody gets me, you do (do)  You do ",14,9,-0.13899894641793292,1,18,4,0.012347826086956526
Bailey Zimmerman,Rock and A Hard Place,"We been swinging and missing It ain't broke yet, but damn, it needs fixing Been a while since your kiss felt like kissing It's just different  We've been talking 'bout forever since we been together Something 'bout a ring makes you think we're better off with all this But we're caught up in between  A rock and a hard place, red wine and mistakes Tears rolling down your face when I walked out that door That's when I lost it, a midnight in Austin ",10,3,-0.30507609477409947,0,12,1,-0.03366923076923078
NewJeans,OMG,"이 노래는, it's about you, baby Only you You, you, you, you, you, you, you  내가 힘들 때 울 것 같을 때 기운도 이젠 나지 않을 때 (It's you) 날 걱정하네, (it's you) 날 웃게하네 말 안 해도 돼, boy, what do you say?  (They keep on asking me, ""who is he?"") 멀리든 언제든지 달려와 (They keep on asking me, ""who is he?"") 바쁜 척도 없이 넌 나타나 (They keep on asking me, ""who is he?"") ""이게 말이 되니?"" 난 물어봐 (They keep on asking me, ""who is he?"") 너는 말야, he's the one that's living in my system, baby  Oh my, oh my God! 예상했어 나 I was really hoping that he will come through Oh my, oh my God! 단 너뿐이야 Asking all the time about what I should do  No, I can never let him go, 너만 생각나 24 난 행운아야 정말로, I know, I know ",15,3,-0.44351544313960606,1,15,2,0.04754444444444444
"Drake, 21 Savage",Jimmy Cooks (feat. 21 Savage),"Just awaken shaken once again, so you know it's on (Just awaken shaken once again, ho, you know it's on) Just awaken shaken once again, so you know it's on (Just awaken shaken once again, ho, you know it's on) Yeah, life Life is only thing we need They need me to go, but I don't wanna leave Rest in peace to Lil Keed  Fuck a pigeonhole, I'm a night owl, this a different mode I might have to make her paint a 6 on her pinky toe Heard you with a shooting guard, just let a nigga know I would have you courtside, not the middle row All good, love, in a minute, though I can't stress about no bitch 'cause I'm a timid soul Plus I'm cookin' up ambition on a kitchen stove Pot start to bubble, see the suds, that shit good to go  Hoes say I'm suave, but I can't get RICO'd Bro think he John Wayne, I bought him yellow stones Love the way they hang, babe, fuck the silicone Everybody fake now, you could crack the code Bust down everything, set in rose gold Dread talkin' to you niggas like I'm J. Cole I can tell her head good before I even know Bitch, don't tell me that you model if you ain't been in Vogue ",32,12,-0.26871744069186126,2,34,8,-0.008838636363636364
The Neighbourhood,Sweater Weather,"And all I am is a man I want the world in my hands I hate the beach but I stand In California with my toes in the sand Use the sleeves of my sweater Let's have an adventure Head in the clouds but my gravity's centered Touch my neck and I'll touch yours You in those little high-waisted shorts, oh  She knows what I think about And what I think about One love, two mouths One love, one house No shirt, no blouse Just us, you find out Nothing that I wouldn't wanna tell you about, no  'Cause it's too cold For you here and now So let me hold Both your hands in the holes of my sweater  And if I may just take your breath away I don't mind if there's not much to say ",17,13,-0.09351791143417358,1,27,2,0.01724666666666667
SZA,Shirt,"Kiss me, dangerous Been so lost without you all around me Get anxious Lead me, don't look back, it's all about you  In the dark right now Feeling lost, but I like it Comfort in my sins, and all about me All I got right now Feel the taste of resentment Simmer in my skin, it's all about  Blood stain on my shirt, new bitch on my nerves Old nigga got curved, going back on my word Damn, bitch, you so thirsty Still don't know my worth, still stressing perfection Let you all in my mental, got me looking too desperate Damn, you ain't deserve  ",15,3,-0.3847910232014126,4,13,1,-0.16643333333333332
Hotel Ugly,Shut up My Moms Calling,"I just want to rewind, I haven't seen you in a long time You got me feeling so lonely Even when you come through, I can tell That it isn't you, so baby bring it in closely  Hate the way I love you but you so sweet I always find a way to say the wrong things I wish that we were laying in the same sheets But lately, you've been acting like you hardly know me  Baby come home, home (so baby won't you say somethin') ",9,3,-0.2885613391796748,1,10,1,0.02988333333333332
NewJeans,Ditto,"우-우, 우-우  우-우, 우-우  Stay in the middle, like you a little Don't want no riddle, 말해줘, say it back Oh, say it ditto, 아침은 너무 멀어 So say it ditto  훌쩍 커버렸어, 함께한 기억처럼 널 보는 내 마음은, 어느새 여름 지나 가을 기다렸지 all this time  Do you want somebody like I want somebody? 날 보고 웃었지만 do you think about me now, yeah? All the time, yeah? All the time?  I got no time to lose 내 길었던 하루, 난 보고 싶어 ",8,1,-0.507778525352478,0,8,1,0.1201888888888889
Kali Uchis,I Wish you Roses,"Ooh, never thought I would be without you I wish you love, I wish you well I wish you roses while you can still smell them With pretty flowers can come the bee sting (ooh, never thought I would be without you) But I wish you love, I wish you well I wish you roses while you can still smell them (ooh) I was a rose in the garden of weeds My petals are soft and silky as my sheets So do not be afraid to get pricked by the thorn While I'm here, I'm someone to honor When I'm gone, I'm someone to mourn  But if you and my heart should someday drift apart I'll make sure to give you these blessings ",18,4,-0.3718687323006717,0,17,5,0.2117318181818182
Morgan Wallen,You Proof,"Hey, I've been throwin' down the whiskey I oughta get my money back Someone said it drowns a memory Ah, but it ain't doing jack Yeah, I've been sippin', I've been buzzin' Shootin' doubles like it's nothing Aw, but nothin' makes you go away  I need something you-proof, something stronger than I'm used to Yeah, I've been pullin' 90 to a 100 Feel like nothing's gonna cut it, that's the hard truth Yeah, I need something you-proof, aw, I need something you-proof  Poured 'em up 'til they shut 'em down, yeah ",11,8,-0.10105060589940924,0,16,3,0.09217368421052632
