artist,song,lyrics,bert_nega,bert_posi,bert_score,nltk_neg,nltk_neu,nltk_pos,nltk_score
Mac Miller,The Spins,"Yeah, woah, woah, woah  I had to cut some niggas off, they didn't mean me no good I come from the ghetto, so my trunk is in my hood She wouldn't wear no panties 'round me even if she could Gave out plenty spankings 'til they got it understood Fuck the nosebleeds, baby, come sit on this wood If you know it's tension, don't come 'round me like it's good I got street smarts and you can't get this out no book I can't right my wrongs, but I can still write these hooks  Oh, time to get exposed You ain't been from 'round here, nigga, come get off your show Savage said you pussy and he hit it on the nose But that board is opеn, why you actin' like it's closed? I don't know Y'all be goin' in and out rеcessions The same way that I be goin' in and out of Texas Or in and out my sessions, or in and out her best friends Or in and out these courtrooms, my lawyer like, ""Objection""  Yeah, woah, woah All my bitches Spanish, boricua Water on my neck, these diamonds came with coral reefer She from overseas, I had to buy her a new visa Met your wife in Vegas, but I hit her in Ibiza She a supermodel, so she only eatin' Caesar Used to date a rapper, but he acted like a diva Niggas hustlin' backwards, out here ballin' with the re-up  Popped an Adderall, I feel like I can lift a tree up Seen too many cameras, so I never lift my ski up (yeah) ",29,13,-0.23638877130690075,1,39,2,0.047280952380952375
Baby Keem,ORANGE SODA,"Now you suck We wanna talk about sex but we're not allowed Well, you may not like it but you better learn how 'cause it's your turn now You're wasting your tongue with lame excuses and lies  So how should I begin this? I guess it started when you were with him And how he never even took you out to dance But did he fuck with any rhythm?  But now he's playing with your head But did he ever make you cum? Did he ever make you cry? Do the wires in your mind get sewn together  Rubbed and severed by the heat You don't know how long I could stare into your picture And wish that it was me I guess it's different 'cause you love him But I've got an interactive Sick and twisted imagination And that's gotta count for something ",14,8,-0.16140928051688455,3,19,0,-0.06205
Ice Spice,In Ha Mood,"When you do your best you ca-, I done told you When you do your best, hell, that's all you can do You and me and anybody else So they always start talkin'  I'm runnin' away from where I'm from Never can stay with no one Lovin' you almost feels like somethin' When no one's around me You lost and found me I was surrounded  With open, open, open, open arms (ooh) Open arms, you give me open I'm so devoted You keep me open (ooh), open arms I'm so devoted to you, to you, to you  Spent your life bein' hopeless ",16,2,-0.4454133179452684,0,17,1,0.02117777777777778
Lil Yachty,running out of time,"Money Oh  Love is just a history that they may prove And when you're gone I'll tell them my religion's you When Punktious comes to kill the king upon his throne I'm ready for their stones  I'll dance, dance, dance With my hands, hands, hands Above my head, head, head Like Jesus said I'm gonna dance, dance, dance With my hands, hands, hands above my head Hands together, forgive him before he's dead, because  I won't cry for you I won't crucify the things you do I won't cry for you See, when you're gone, I'll still be Bloody Mary  Love  We are not just art for Michelangelo to carve ",18,8,-0.24754195717664865,1,23,2,0.04291923076923078
"JAY-Z, Kanye West",Ni**as In Paris,"I love you Turn my headphone down a little bit, yeah For so many reasons Yeah, yeah, yeah, yeah, yeah, yeah (I do) Yeah, yeah yeah yeah Yeah, yeah, ah, ah, whoa, whoa, whoa, yeah  How much money you got? (Straight up) How much money you got? (Straight up) How much money you got? (Straight up) How much money you got? (A lot)  How much money you got? (A lot) How many problems you got? (A lot) How many people done doubted you? (A lot) Left you out to rot? (A lot) How many pray that you flop? (A lot) How many lawyers you got? (A lot) How many times you got shot? (A lot) How many niggas you shot? (A lot) How many times did you ride? (A lot) How many niggas done died? (A lot) How many times did you cheat? (A lot) How many times did you lie? (A lot) How many times did she leave? (A lot) How many times did she cry? (A lot) How many chances she done gave you Fuckin' around with these thots? (A lot)  Every day that I'm alive, I'ma ride with the stick I'd rather be broke in jail than be dead and rich Told my brothers take my breath if I turn to a snitch But I'm 21 4L, ain't no way I'ma switch  Break it on down, I break it on down I break it on down, I break it on down I break it down, I break it down I break it down, I break it down  Penitentiary chances just to make a couple bucks My heart so cold I could put it in my cup Gang vs. the world, me and my dawg, it was us Then you went and wrote a statement And that really fucked me up My brother lost his life and it turned me to a beast My brother got life and it turned me to the streets I been through the storm and it turned me to a G But the other side was sunny, I get paid to rap on beats ",40,36,-0.05131627854548002,1,66,9,0.015419736842105269
"Drake, 21 Savage",On BS,While she's been away Living day-to-day has been tough  I found her at my side Simply being alive has been rough  Know she won't be gone forever There are many times I find it feels that way  And I'm not trying to forget her ,4,5,0.05760347843170166,0,9,0,0.04703333333333334
TV Girl,Not Allowed,"Nobody pray for me It been that day for me Way (yeah, yeah!)  Ayy, I remember syrup sandwiches and crime allowances Finesse a nigga with some counterfeits, but now I'm countin' this Parmesan where my accountant lives; in fact, I'm downin' this D'USSÉ with my boo bae tastes like Kool-Aid for the analysts  Girl, I can buy yo' ass the world with my paystub Ooh, that pussy good, won't you sit it on my taste buds? I get way too petty once you let me do the extras Pull up on your block, then break it down, we playin' Tetris  A.m. to the p.m., p.m. to the a.m., funk Piss out your per diem, you just gotta hate 'em, funk If I quit your BM, I still ride Mercedes, funk If I quit this season, I still be the greatest, funk  My left stroke just went viral Right stroke put lil' baby in a spiral Soprano C, we like to keep it on a high note It's levels to it, you and I know  Bitch, be humble (hol' up, bitch) Sit down (hol' up, lil', hol' up, lil' bitch) Be humble (hol' up, bitch) Sit down (hol' up, sit down, lil', sit down, lil' bitch) ",31,11,-0.28808513283729553,0,38,4,-0.02252142857142857
"SZA, Travis Scott",Open Arms (feat. Travis Scott),"Everyone seems a damn genius lately Tik-Tok talking, late-night TV Still so much I have yet to know We get dressed up just to go downtown In some ego-filled late night crowd It seems to be where I feel most alone  I'd like to get lost on some old back road Find a shade tree and a honey hole And talk to my grandpa again And I see God in everything The trees and pain and nights in the spring So why do I still long for a home?  I'd like to lay in a field on a cozy blanket And feel the fear of never wakin' To know the true warmth of thе sun I'd like to love my lady long and hard And lay down lines of laymеn guitar Never leave her loving arms again  My exes hate me and my friends all miss me ",23,4,-0.4089604792771516,1,22,4,-0.012899999999999997
Lady Gaga,Bloody Mary,"You good, T-Minus?  Niggas been countin' me out I'm countin' my bullets, I'm loadin' my clips I'm writin' down names, I'm makin' a list I'm checkin' it twice and I'm gettin' 'em hit The real ones been dyin', the fake ones is lit The game is off balance, I'm back on my shit The Bentley is dirty, my sneakers is dirty But that's how I like it, you all on my dick  I'm all in my bag, this hard as it get I do not snort powder, I might take a sip I might hit the blunt, but I'm liable to trip I ain't poppin' no pill, but you do as you wish I roll with some fiends, I love 'em to death I got a few mil' but not all of them rich What good is the bread if my niggas is broke? What good is first class if my niggas can't sit?  That's my next mission, that's why I can't quit Just like LeBron, get my niggas more chips Just put the Rollie right back on my wrist This watch came from Drizzy, he gave me a gift Back when the rap game was prayin' I'd diss They act like two legends cannot coexist But I'd never beef with a nigga for nothin' If I smoke a rapper, it's gon' be legit  It won't be for clout, it won't be for fame It won't be 'cause my shit ain't sellin' the same It won't be to sell you my latest lil' sneakers ",30,17,-0.1695338677852712,1,43,3,-0.017699999999999994
21 Savage,a lot,"You're the only power (Power) You're the only power that can You're the only power (Power) You're the only power that can Fa (Fa), fa (Fa), fa (Fa) Father  If young Metro don't trust you I'm gon' shoot you  Beautiful morning, you're the sun in my morning babe Nothing unwanted Beautiful morning, you're the sun in my morning babe Nothing unwanted  I just wanna feel liberated, I, I, I ",13,9,-0.13837099346247586,0,19,3,0.03615909090909091
Mac DeMarco,For the First Time,"Oh, yeah I guarantee I got ya  I've been craving for your love Can't see nobody, but us (see nobody, but us) So I, so I, so I See you from across the room Make my way over to you (my way over to you) I'm tripping over butterflies  Oh, yeah, baby, I don't really mean to rush But I'ma really need your touch if I'ma make it through the night I got the moonlight, tequila sunrise Uh, come take a shot on me, I got ya  I don't know how to say this, I hope this song's on your playlist This feeling, so hard to explain I don't even know how to talk right now, it's ""I need you"" o'clock right now I want you to hear me say  Moonlight sunrise, baby, come, be my starlight ",21,6,-0.33189900936903777,0,23,4,0.07045925925925926
Kendrick Lamar,HUMBLE.,"Mama, I'm calling, I've got some news Don't you tell Daddy, he'll blow a fuse Don't worry I'm doing okay  I know you raised me to know right from wrong It ain't what you think And I'm still writing songs Just never thought I'd see the day I've never felt this way  I met somebody, and he's got blue eyes He opens the door, and he don't make me cry He ain't from where we're from, but he feels like home He's got me doing things I've never done In Georgia they'd call it a sin I'm wearing Tennessee orange for him ",16,7,-0.23143611524416052,0,22,1,0.017743478260869566
Zach Bryan,"Burn, Burn, Burn","You could have anyone you want Why would you want to be with me? I'm nothing special  You could have anyone you want Why would you want to be with me? You know, I'm nothing special  Be with whoever you want I don't care, I don't care I don't wanna know  Don't tell me about your problems If you're not trying to solve them Don't ask me for my help ",8,6,-0.08718362024852208,4,10,0,-0.08270714285714285
J. Cole,MIDDLE CHILD,"Don't remind me Don't try to find me  Don't remind me I'm mindin' my own damn business Don't try to find me I'm better left alone than in this It doesn't surprise me Do you really think that I could care? If you really don't like me Find somebody else It could be anyone else out there  Don't fret I don't ever wanna see you And I never wanna miss you again One thing When you're angry, you're a jerk ",11,7,-0.12642636564042833,1,16,1,-0.04453888888888888
Kanye West,Father Stretch My Hands Pt. 1,"Imagine life Imagine life without me, it's a waste of time You want the kind of love that can make a child Don't want just anybody (Not just anybody, not just anybody) Good love fill my body up like a glass When you pour it all out If you know me, you know I mind Someone like me is hard to find Not mistaking, if I am there Well aware you are always mine And still you seem so surprised Always gon' be mine  I wanna be where you are I just can't walk away ",14,3,-0.3778697602889117,0,16,1,0.16939411764705886
"PinkPantheress, Ice Spice",Boy's a liar Pt. 2,"Take a look inside your heart, is there any room for me? I won't have to hold my breath 'til you get down on one knee Because you only want to hold me when I'm looking good enough Did you ever feel me? Would you ever picture us? Every time I pull my hair, well, it's only out of fear That you'll find me ugly and one day you'll disappear because  What's the point of crying? It was never even love Did you ever want me? Was I ever good enough?  The-the boy's a liar, the boy's a liar He doesn't see ya, you're not looking at me, boy The boy's a liar, the boy's a liar He doesn't see ya, you're not looking at me, boy  ",12,6,-0.2221544020705753,2,15,1,-0.1335111111111111
"KAROL G, Romeo Santos",X SI VOLVEMOS,"Shoutout my label that's me I'm in this bitch with TB I'm in this bitch with Four-trey I just poured up me a eight Real nigga all in my face 500 racks in my safe 500 racks to the plug What you know 'bout showing love  What you know 'bout pullin' up, in Bentley trucks Make these bitches fall in love All of my niggas on go None of my niggas no hoe All of my niggas want smoke All of my niggas together We came from the bottom we used to wear each other clothes  None of my niggas gon' fold Couple pussy niggas told They ain't my niggas no mo' Hold it down for the four In the nine with the woes Marlo my dawg, that's for sho' We won't fall out about shit Specially not 'bout no bitch We ain't gone fallout 'bout hoes Me and Ced get them loads We let 'em go for the low I got my hood in control  ",15,15,-0.020671387513478596,2,24,4,-0.049416666666666664
Jordan Davis,What My World Spins Around,"Wait right here I'll be back in the morning I know that I'm not that important to you But to me, girl, you're so much more than gorgeous So much more than perfect Right now I know that I'm not really worth it If you give me time, I could work on it Give me some time while I work on it  Losin' your patience, and, girl, I don't blame you The Earth's in rotation, you're waiting for me Look at my face when I fuck on your waist 'Cause we only have one conversation a week ",12,8,-0.1379006624221802,1,18,1,0.0369
Kendrick Lamar,PRIDE.,"Talk to me  I don't want to let you down, I don't want to let you down  I don't want to let you down, I don't want to let you down  You see how we living, yeah I'm tryna keep it as simple as possible You know what I do  Get you Gucci on sight, yeah, Rollies on ice, yeah Get first class flights, yeah, ride it like a bike, yeah Get a brand new Wag, ayy, be quiet, don't brag, hey Never pump gas, hey, nigga, keep it on task, yeah  Peelin' off, flex, hey, keep it on track, hey Fussin' and fightin', yeah, f- all night, ayy Gotta make it count, yeah, love it when it bounce, yeah Girl, that's tight, yeah, you do whatever you like, yeah Gucci on sight, yeah, Rollie on ice, yeah Take my advice, ayy, live a better life  ",22,1,-0.5501635592916737,0,22,1,0.1945086956521739
Zach Bryan,Heading South,"5:34 a.m., I was about to start my day But she layin' there across me, so I stayed anyway Arms tied, legs numb, wrapped around my knee Sweetest of the sunflowers, yeah, you're the sun to me  I don't recall what you were wearin' on the first night we met Besides the subtle cloud around you from my last cigarette And you come from a good place with a happy family The only bad you've ever done was to see the good in me  ",6,3,-0.20269536972045898,0,9,0,0.06309999999999999
Falling In Reverse,Watch The World Burn,"We're gonna skate to one song and one song only (Ball so hard, motherfuckers wanna fine me)  So I ball so hard, motherfuckers wanna fine me But first niggas gotta find me What's fifty grand to a motherfucker like me? Can you please remind me? Ball so hard, this shit crazy Y'all don't know that don't shit faze me The Nets could go 0 for 82 And I look at you like this shit gravy  Ball so hard, this shit weird We ain't even 'posed to be here Ball so hard, but since we here It's only right that we'd be fair Psycho, I'm liable To go Michael, take your pick Jackson, Tyson, Jordan, Game 6  Ball so hard, got a broke clock Rollies that don't tick-tock Audemars that's losing time Hidden behind all these big rocks B-Ball so hard, I'm shocked too I'm supposed to be locked up too You escaped what I escaped You'd be in Paris getting fucked up too  B-Ball so hard, let's get faded Le Meurice for like six days Gold bottles, scold models Spillin' Ace on my sick J's B-Ball so hard, bitch, behave Just might let you meet 'Ye Chi-Towns, D. Rose I'm moving the Nets, BK  ",40,17,-0.2469305532020435,7,47,3,-0.08811228070175438
"Bad Bunny, Bomba Estéreo",Ojitos Lindos,I never stay in one place too long A dirt road's singing me a siren song I gotta find a field I need to spin my wheels I got a hankering for four wide tires And I can't help it it's the way I'm wired 'Fore you get too close Boy you need to know  I got a heart like a truck It's been drug through the mud Runs on dreams and gasoline And that ole highway holds the key It's got a lead foot down when it's leaving Lord knows it's taken a hell of a beating A little bit of love is all that it's needing But it's good as it is tough I got a heart like a truck ,8,11,0.09189769782518085,1,18,0,0.038615789473684214
Lainey Wilson,Heart Like A Truck,"Don't blame me, love made me crazy If it doesn't, you ain't doin' it right Lord, save me, my drug is my baby I'll be usin' for the rest of my life  I've been breakin' hearts a long time And, toyin' with them older guys Just playthings for me to use Something happened for the first time In the darkest little paradise Shakin', pacin', I just need you  For you, I would cross the line I would waste my time I would lose my mind They say, she's gone too far this time  Don't blame me, love made me crazy If it doesn't, you ain't doin' it right Lord, save me, my drug is my baby I'll be usin' for the rest of my life  Don't blame me, love made me crazy If it doesn't, you ain't doin' it right Oh, Lord, save me, my drug is my baby I'll be usin' for the rest of my life ",19,6,-0.31203885316848756,3,21,1,-0.035651999999999996
"Kane Brown, Katelyn Brown",Thank God,"Never need a bitch, I'm what a bitch need (Bitch need) Tryna find the one that can fix me I've been dodgin' death in the six speed Amphetamine got my stummy feelin' sickly  Yeah, I want it all now I've been runnin' through the pussy, need a dog pound Hundred models gettin' faded in the compound Tryna love me, but they never get a pulse down  Why? 'Cause I'm heartless And I'm back to my ways 'cause I'm heartless All this money and this pain got me heartless Low life for life 'cause I'm heartless  Said I'm heartless Tryna be a better man, but I'm heartless Never be a weddin' plan for the heartless Low life for life 'cause I'm heartless  Said I'm heartless ",22,7,-0.2928364585185873,10,17,2,-0.19306551724137933
"Ozuna, Feid",Hey Mor,"Baby love, I think I've been a little too kind Didn't notice you walking all over my peace of mind In the shoes I gave you as a present Putting someone first only works When you're in their top 5 And by the way I'm going out tonight  Best believe I'm still bejeweled When I walk in the room I can still make the whole place shimmer And when I meet the band They ask, ""Do you have a man?"" I could still say, ""I don't remember"" Familiarity breeds contempt Don't put me in the basement When I want the penthouse of your heart Diamonds in my eyes I polish up real I polish up real nice  Nice!  Baby boy, I think I've been too good of a girl (Too good of a girl) Did all the extra credit then got graded on a curve I think it's time to teach some lessons ",22,13,-0.14647425583430698,1,31,3,0.11855714285714285
21 Savage,ball w/o you,"She's alright That girl's alright with me, yeah Ayy-yo (hey, hey, hey, hey)  I can lick it, I can ride it while you slipping and sliding I can do all them little tricks, and keep the dick up inside it You can smack it, you can grip it, you can go down and kiss it And every time he leave me 'lone, he always tell me he miss it  He want a F-R-E, A-K F-R-E, A-K, A-K, A-K, A-K E-A-K, F-R-E-A-K  Uh, okay, one thing about me, I'm the baddest alive He know the prettiest bitch didn't come until I arrive I don't let bitches get to me, I fuck they man if they try I got a princess face, a killer body, samurai mind They can't be Nicki, they so stupid, I just laugh when they try A thong bikini up my ass, I think I'll go for a dive His ex bitch went up against me, but she didn't survive On applications, I write ""pressure"" 'cause that's what I apply (brrr) ",41,9,-0.3955471050739288,1,43,6,-0.012158000000000002
Morgan Wallen,More Than My Hometown,"Yeah, woah, woah, woah  I had to cut some niggas off, they didn't mean me no good I come from the ghetto, so my trunk is in my hood She wouldn't wear no panties 'round me even if she could Gave out plenty spankings 'til they got it understood Fuck the nosebleeds, baby, come sit on this wood If you know it's tension, don't come 'round me like it's good I got street smarts and you can't get this out no book I can't right my wrongs, but I can still write these hooks  Oh, time to get exposed You ain't been from 'round here, nigga, come get off your show Savage said you pussy and he hit it on the nose But that board is opеn, why you actin' like it's closed? I don't know Y'all be goin' in and out rеcessions The same way that I be goin' in and out of Texas Or in and out my sessions, or in and out her best friends Or in and out these courtrooms, my lawyer like, ""Objection""  Yeah, woah, woah All my bitches Spanish, boricua Water on my neck, these diamonds came with coral reefer She from overseas, I had to buy her a new visa Met your wife in Vegas, but I hit her in Ibiza She a supermodel, so she only eatin' Caesar Used to date a rapper, but he acted like a diva Niggas hustlin' backwards, out here ballin' with the re-up  Popped an Adderall, I feel like I can lift a tree up Seen too many cameras, so I never lift my ski up (yeah) ",29,13,-0.23638877130690075,1,39,2,0.047280952380952375
Frank Ocean,Lost,"I was scared of dentists and the dark I was scared of pretty girls and starting conversations Oh, all my friends are turning green You're the magician's assistant in their dream  Ah-ooh-ooh-ooh, ah-ahh-ah-ah And they come unstuck  Lady, running down to the riptide Taken away to the dark side I wanna be your left-hand man I love you when you're singing that song And I got a lump in my throat 'Cause you're gonna sing the words wrong  There's this movie that I think you'll like This guy decides to quit his job and heads to New York City This cowboy's running from himself And she's been living on the highest shelf  ",17,4,-0.3530791799227397,0,20,1,0.04213809523809524
Fleetwood Mac,Dreams - 2004 Remaster,"I want to see you work out for me, work out for me  Hey, we got a good thing Don't know if I'ma see you again But is that a good thing? 'Cause girl, I can't be your man, no ma'am I know what's on your brain You probably hoped it never would end Like, is it the real thing? Or is it just a one night stand? Well then  Let me see you get high and go low Now, girl won't you drop that thing down to the floor I'm here for one night, how far will you go? I wanna see you (Work out for me, work out for me)  High, and go low Now, girl won't you drop that thing down to the floor I'm here for one night, how far will you go? I wanna see you (Work out for me, work out for me)  She like them boys with the big ol' chains Ride around town in the big old Range I knew her when I rocked big old jeans Now the little nigga doin' big old things Would you look at that? I came back for her Just to give it to her, like you asked for it Man that thing in them jeans too fat for her Rebounds so I caught it off the backboard  I told her, baby girl come here Know I run the town even when I ain't from there And I brag hardly, but just to show up at this party  I made what your nigga make in one year That's unfair, but so is life take a chance roll a dice Money can't buy you love 'cause it's overpriced ",30,13,-0.2317570350890936,0,42,1,0.061562790697674424
"Lil Wayne, Drake, Future",Love Me,"Everyone seems a damn genius lately Tik-Tok talking, late-night TV Still so much I have yet to know We get dressed up just to go downtown In some ego-filled late night crowd It seems to be where I feel most alone  I'd like to get lost on some old back road Find a shade tree and a honey hole And talk to my grandpa again And I see God in everything The trees and pain and nights in the spring So why do I still long for a home?  I'd like to lay in a field on a cozy blanket And feel the fear of never wakin' To know the true warmth of thе sun I'd like to love my lady long and hard And lay down lines of laymеn guitar Never leave her loving arms again  My exes hate me and my friends all miss me ",23,4,-0.4089604792771516,1,22,4,-0.012899999999999997
Luke Combs,Love You Anyway,If your kiss turned me to stone I'd be a statue standing tall in Ancient Rome And if your touch shattered me like glass I'd be in pieces trying to make the breaking last  If it took one look to turn my days to night At least I'd have the stars that sparkle in your eyes  There's just some things that leave a man no choice Like a compass needle needing its true North Even if I knew the day we met you'd be the reason this heart breaks ,5,9,0.15408813527652196,0,13,1,0.07132142857142856
